name,title,countries,services,thumbnail,logo,description
sand and vanish,Wood and timber,"sg,my",maintenance,websites/products/thumbnails/Wood%20and%20Timber%20thumbnail.jpeg,,"Expert Wood Services: Comprehensive and efficient wood maintenance, ensuring stunning results with minimal dust for a pristine finish. Discover our exceptional wood care solutions."
accoya,Treated timber Accoya®,"sg,my",exterior,websites/products/thumbnails/Accoya.jpg,,"Sustainable acetylated Pine: High Durability, Termite-Fungal-Water Resistance. Perfect for All Weather Conditions."
calvary composite,Composite Decking,"sg,my",exterior,websites/products/thumbnails/Composite%20Decking.jpg,,"#1 Removable Decking in Singapore. Experience Lasting Beauty, Unmatched Durability, and Effortless Maintenance."
kandinsky,engineered flooring,"sg,my",interior,websites/products/thumbnails/Engineered%20Flooring.jpg,,Where Art Meets Wood: Kandinsky® - Explore Our Timber. Experience the Beauty of Natural Patterns and a Broad Spectrum of Colors.
moso bamboo,MOSO® Bamboo,my,exterior,websites/products/thumbnails/MOSO%20Bamboo.jpeg,,"Discover reconstituted Bamboo, the fastest growing and sustainable material with high durability and class 0 fire rating. Available for outdoor and indoors."
osmo,OSMO®,"sg,my",maintenance,websites/products/thumbnails/Osmo%20Thumbnail.jpg,,"Seamless Wood Finishing Excellence: 140+ Years of Innovation. Unrivaled Coating Systems for Ultimate Protection, Beauty, and Maintenance Simplification."
silverwood,Silverwood®,"sg,my",maintenance,websites/products/thumbnails/Silverwood%20Thumbnail.jpg,,"Eco-friendly Silverwood Coating: Stunning Natural Finish, Enhanced Protection Against Fungi & Fire, Low Maintenance, and Solar Reflective - Transforming Wood Sustainability."
timber decking,timber decking,"sg,my","interior,exterior",websites/products/thumbnails/Timber%20Decking.jpg,,"Discover Unrivalled Woodwork and High-Performance Timbers. Endless Possibilities: Trellis, Benches, Cladding, Ceilings, Screens."